<?xml version="1.0" encoding="UTF-8"?>
<xs:schema xmlns:xs="http://www.w3.org/2001/XMLSchema">
    <xs:element name="universidad">
        <xs:complexType>
            <xs:sequence>
                <xs:element name="campus" maxOccurs="unbounded">
                    <xs:complexType>
                        <xs:sequence>
                            <xs:element name="edificio" maxOccurs="unbounded">
                                <xs:complexType>
                                    <xs:sequence>
                                        <xs:element name="nombre" type="xs:string"></xs:element>
                                        <xs:element name="departamento-academico" type="xs:string"></xs:element>
                                        <xs:element name="habitacion">
                                            <xs:complexType>
                                                <xs:simpleContent>
                                                    <xs:extension base="xs:string">
                                                        <xs:attribute name="numero" type="xs:string"
                                                            use="required"></xs:attribute>
                                                        <xs:attribute name="capacidad"
                                                            type="xs:string" use="required"></xs:attribute>
                                                    </xs:extension>
                                                </xs:simpleContent>
                                            </xs:complexType>
                                        </xs:element>
                                    </xs:sequence>
                                </xs:complexType>
                            </xs:element>
                        </xs:sequence>
                    </xs:complexType>
                </xs:element>
            </xs:sequence>
            <xs:attribute name="cod" type="xs:string" use="required"></xs:attribute>
        </xs:complexType>
    </xs:element>
</xs:schema>